{
  "site_id": "gh-01",
  "site_version": "2026-04-11-a",
  "catalog_version": "2026-04-11-a",
  "registry_version": "2026-04-11-a",
  "channel_map_version": "2026-04-11-a",
  "channels": [
    {
      "channel_ref": "plc_tag://gh-01-dry-plc/dry_room/dehumidifier_01/run_state",
      "controller_id": "gh-01-dry-plc",
      "protocol": "plc_tag_modbus_tcp",
      "access": "read",
      "table": "discrete_input",
      "address": 11001,
      "data_type": "boolean",
      "quantity": 1,
      "scale": 1.0,
      "notes": "generated placeholder address map"
    },
    {
      "channel_ref": "plc_tag://gh-01-dry-plc/dry_room/dehumidifier_01/stage_cmd",
      "controller_id": "gh-01-dry-plc",
      "protocol": "plc_tag_modbus_tcp",
      "access": "write",
      "table": "holding_register",
      "address": 41001,
      "data_type": "uint16",
      "quantity": 1,
      "scale": 1.0,
      "notes": "generated placeholder address map"
    },
    {
      "channel_ref": "plc_tag://gh-01-dry-plc/dry_room/dehumidifier_01/stage_feedback",
      "controller_id": "gh-01-dry-plc",
      "protocol": "plc_tag_modbus_tcp",
      "access": "read",
      "table": "input_register",
      "address": 31001,
      "data_type": "uint16",
      "quantity": 1,
      "scale": 1.0,
      "notes": "generated placeholder address map"
    },
    {
      "channel_ref": "plc_tag://gh-01-dry-plc/dry_room/dry_fan_01/run_state",
      "controller_id": "gh-01-dry-plc",
      "protocol": "plc_tag_modbus_tcp",
      "access": "read",
      "table": "discrete_input",
      "address": 11002,
      "data_type": "boolean",
      "quantity": 1,
      "scale": 1.0,
      "notes": "generated placeholder address map"
    },
    {
      "channel_ref": "plc_tag://gh-01-dry-plc/dry_room/dry_fan_01/speed_cmd",
      "controller_id": "gh-01-dry-plc",
      "protocol": "plc_tag_modbus_tcp",
      "access": "write",
      "table": "holding_register",
      "address": 41002,
      "data_type": "uint16",
      "quantity": 1,
      "scale": 1.0,
      "notes": "generated placeholder address map"
    },
    {
      "channel_ref": "plc_tag://gh-01-dry-plc/dry_room/dry_fan_01/speed_feedback",
      "controller_id": "gh-01-dry-plc",
      "protocol": "plc_tag_modbus_tcp",
      "access": "read",
      "table": "input_register",
      "address": 31002,
      "data_type": "uint16",
      "quantity": 1,
      "scale": 1.0,
      "notes": "generated placeholder address map"
    },
    {
      "channel_ref": "plc_tag://gh-01-main-plc/nutrient_room/nutrient_mixer_01/fault_code",
      "controller_id": "gh-01-main-plc",
      "protocol": "plc_tag_modbus_tcp",
      "access": "read",
      "table": "input_register",
      "address": 30001,
      "data_type": "uint16",
      "quantity": 1,
      "scale": 1.0,
      "notes": "generated placeholder address map"
    },
    {
      "channel_ref": "plc_tag://gh-01-main-plc/nutrient_room/nutrient_mixer_01/recipe_cmd",
      "controller_id": "gh-01-main-plc",
      "protocol": "plc_tag_modbus_tcp",
      "access": "write",
      "table": "holding_register",
      "address": 40001,
      "data_type": "uint16",
      "quantity": 1,
      "scale": 1.0,
      "notes": "generated placeholder address map"
    },
    {
      "channel_ref": "plc_tag://gh-01-main-plc/nutrient_room/nutrient_mixer_01/recipe_stage",
      "controller_id": "gh-01-main-plc",
      "protocol": "plc_tag_modbus_tcp",
      "access": "read",
      "table": "input_register",
      "address": 30002,
      "data_type": "uint16",
      "quantity": 1,
      "scale": 1.0,
      "notes": "generated placeholder address map"
    },
    {
      "channel_ref": "plc_tag://gh-01-main-plc/nutrient_room/nutrient_mixer_01/run_state",
      "controller_id": "gh-01-main-plc",
      "protocol": "plc_tag_modbus_tcp",
      "access": "read",
      "table": "discrete_input",
      "address": 10001,
      "data_type": "boolean",
      "quantity": 1,
      "scale": 1.0,
      "notes": "generated placeholder address map"
    },
    {
      "channel_ref": "plc_tag://gh-01-main-plc/nutrient_room/source_water_valve_01/fault_code",
      "controller_id": "gh-01-main-plc",
      "protocol": "plc_tag_modbus_tcp",
      "access": "read",
      "table": "input_register",
      "address": 30003,
      "data_type": "uint16",
      "quantity": 1,
      "scale": 1.0,
      "notes": "generated placeholder address map"
    },
    {
      "channel_ref": "plc_tag://gh-01-main-plc/nutrient_room/source_water_valve_01/open_close_cmd",
      "controller_id": "gh-01-main-plc",
      "protocol": "plc_tag_modbus_tcp",
      "access": "write",
      "table": "holding_register",
      "address": 40002,
      "data_type": "boolean",
      "quantity": 1,
      "scale": 1.0,
      "notes": "generated placeholder address map"
    },
    {
      "channel_ref": "plc_tag://gh-01-main-plc/nutrient_room/source_water_valve_01/run_state",
      "controller_id": "gh-01-main-plc",
      "protocol": "plc_tag_modbus_tcp",
      "access": "read",
      "table": "discrete_input",
      "address": 10002,
      "data_type": "boolean",
      "quantity": 1,
      "scale": 1.0,
      "notes": "generated placeholder address map"
    },
    {
      "channel_ref": "plc_tag://gh-01-main-plc/zone_a/circulation_fan_01/fault_code",
      "controller_id": "gh-01-main-plc",
      "protocol": "plc_tag_modbus_tcp",
      "access": "read",
      "table": "input_register",
      "address": 30004,
      "data_type": "uint16",
      "quantity": 1,
      "scale": 1.0,
      "notes": "generated placeholder address map"
    },
    {
      "channel_ref": "plc_tag://gh-01-main-plc/zone_a/circulation_fan_01/run_state",
      "controller_id": "gh-01-main-plc",
      "protocol": "plc_tag_modbus_tcp",
      "access": "read",
      "table": "discrete_input",
      "address": 10003,
      "data_type": "boolean",
      "quantity": 1,
      "scale": 1.0,
      "notes": "generated placeholder address map"
    },
    {
      "channel_ref": "plc_tag://gh-01-main-plc/zone_a/circulation_fan_01/speed_cmd",
      "controller_id": "gh-01-main-plc",
      "protocol": "plc_tag_modbus_tcp",
      "access": "write",
      "table": "holding_register",
      "address": 40003,
      "data_type": "uint16",
      "quantity": 1,
      "scale": 1.0,
      "notes": "generated placeholder address map"
    },
    {
      "channel_ref": "plc_tag://gh-01-main-plc/zone_a/circulation_fan_01/speed_feedback",
      "controller_id": "gh-01-main-plc",
      "protocol": "plc_tag_modbus_tcp",
      "access": "read",
      "table": "input_register",
      "address": 30005,
      "data_type": "uint16",
      "quantity": 1,
      "scale": 1.0,
      "notes": "generated placeholder address map"
    },
    {
      "channel_ref": "plc_tag://gh-01-main-plc/zone_a/circulation_fan_02/fault_code",
      "controller_id": "gh-01-main-plc",
      "protocol": "plc_tag_modbus_tcp",
      "access": "read",
      "table": "input_register",
      "address": 30006,
      "data_type": "uint16",
      "quantity": 1,
      "scale": 1.0,
      "notes": "generated placeholder address map"
    },
    {
      "channel_ref": "plc_tag://gh-01-main-plc/zone_a/circulation_fan_02/run_state",
      "controller_id": "gh-01-main-plc",
      "protocol": "plc_tag_modbus_tcp",
      "access": "read",
      "table": "discrete_input",
      "address": 10004,
      "data_type": "boolean",
      "quantity": 1,
      "scale": 1.0,
      "notes": "generated placeholder address map"
    },
    {
      "channel_ref": "plc_tag://gh-01-main-plc/zone_a/circulation_fan_02/speed_cmd",
      "controller_id": "gh-01-main-plc",
      "protocol": "plc_tag_modbus_tcp",
      "access": "write",
      "table": "holding_register",
      "address": 40004,
      "data_type": "uint16",
      "quantity": 1,
      "scale": 1.0,
      "notes": "generated placeholder address map"
    },
    {
      "channel_ref": "plc_tag://gh-01-main-plc/zone_a/circulation_fan_02/speed_feedback",
      "controller_id": "gh-01-main-plc",
      "protocol": "plc_tag_modbus_tcp",
      "access": "read",
      "table": "input_register",
      "address": 30007,
      "data_type": "uint16",
      "quantity": 1,
      "scale": 1.0,
      "notes": "generated placeholder address map"
    },
    {
      "channel_ref": "plc_tag://gh-01-main-plc/zone_a/co2_doser_01/dose_cmd",
      "controller_id": "gh-01-main-plc",
      "protocol": "plc_tag_modbus_tcp",
      "access": "write",
      "table": "holding_register",
      "address": 40005,
      "data_type": "uint16",
      "quantity": 1,
      "scale": 1.0,
      "notes": "generated placeholder address map"
    },
    {
      "channel_ref": "plc_tag://gh-01-main-plc/zone_a/co2_doser_01/dose_feedback",
      "controller_id": "gh-01-main-plc",
      "protocol": "plc_tag_modbus_tcp",
      "access": "read",
      "table": "input_register",
      "address": 30008,
      "data_type": "uint16",
      "quantity": 1,
      "scale": 1.0,
      "notes": "generated placeholder address map"
    },
    {
      "channel_ref": "plc_tag://gh-01-main-plc/zone_a/co2_doser_01/run_state",
      "controller_id": "gh-01-main-plc",
      "protocol": "plc_tag_modbus_tcp",
      "access": "read",
      "table": "discrete_input",
      "address": 10005,
      "data_type": "boolean",
      "quantity": 1,
      "scale": 1.0,
      "notes": "generated placeholder address map"
    },
    {
      "channel_ref": "plc_tag://gh-01-main-plc/zone_a/heater_01/fault_code",
      "controller_id": "gh-01-main-plc",
      "protocol": "plc_tag_modbus_tcp",
      "access": "read",
      "table": "input_register",
      "address": 30009,
      "data_type": "uint16",
      "quantity": 1,
      "scale": 1.0,
      "notes": "generated placeholder address map"
    },
    {
      "channel_ref": "plc_tag://gh-01-main-plc/zone_a/heater_01/run_state",
      "controller_id": "gh-01-main-plc",
      "protocol": "plc_tag_modbus_tcp",
      "access": "read",
      "table": "discrete_input",